{
  "$schema": "https://json-schema.org/draft/2020-12/schema",
  "$id": "https://tools.allegedly-media.com/schedule/api/contracts/mandation-engine.read.schema.json",
  "title": "Signal Schedule Mandation Engine Read Contract",
  "type": "object",
  "required": ["meta", "summary", "policyProfile", "shortages", "rotation", "evaluations", "overrideLog", "employeeView", "rules"],
  "properties": {
    "meta": { "type": "object" },
    "summary": { "type": "object" },
    "policyProfile": { "type": "object" },
    "shortages": { "type": "array", "items": { "type": "object" } },
    "rotation": { "type": "array", "items": { "type": "object" } },
    "evaluations": { "type": "array", "items": { "type": "object" } },
    "overrideLog": { "type": "array", "items": { "type": "object" } },
    "employeeView": { "type": "object" },
    "rules": { "type": "array", "items": { "type": "string" } }
  },
  "additionalProperties": true
}
