{
  "meta": {
    "version": "v2.25.0",
    "agencyId": "agency-central-dispatch",
    "module": "mandation-engine-foundation",
    "status": "preview-only",
    "lastCalculatedAt": "2026-06-14T04:30:00Z"
  },
  "summary": {
    "employeesInRotation": 8,
    "currentlyEligible": 5,
    "temporarilySkipped": 3,
    "openShortages": 3,
    "supervisorOverrides": 2
  },
  "policyProfile": {
    "id": "policy-dispatch-custom-001",
    "name": "Central Dispatch Custom Mandation Policy",
    "allowHoldover": true,
    "allowEarlyIn": true,
    "allowMandateOnDayOff": true,
    "allowShortDayWindowEligibility": true,
    "allowCrossDayMandates": true,
    "allowCrossShiftGroupMandates": false,
    "requireRoleQualification": true,
    "minimumRestHours": 8,
    "maxConsecutiveWorkHours": 16,
    "maxDayOffMandateHours": 8,
    "maxConnectedMandateHours": 4,
    "rotationMethod": "eligible-next-in-rotation",
    "hardRules": [
      "Employee must have required role/qualification unless admin override is documented.",
      "Hard agency safety cap cannot exceed 24 consecutive hours."
    ],
    "softRules": [
      "Minimum rest, connected-hour cap, day-off cap, and rotation order may be overridden by supervisor/admin with reason.",
      "All skips, recommendations, and overrides are written to audit history."
    ]
  },
  "shortages": [
    {
      "id": "shortage-001",
      "date": "2026-06-15",
      "window": "0100-0500",
      "role": "Dispatcher",
      "reason": "Night shift sick call",
      "minimumRequired": 4,
      "scheduled": 3,
      "selectedEmployeeId": "emp-james",
      "recommendation": "Mandate James as connected holdover from short day."
    },
    {
      "id": "shortage-002",
      "date": "2026-06-15",
      "window": "0500-0900",
      "role": "Dispatcher",
      "reason": "Day shift sick call",
      "minimumRequired": 4,
      "scheduled": 3,
      "selectedEmployeeId": "emp-morgan",
      "recommendation": "Skip James because shortage is not adjacent to his actual or next scheduled work window."
    },
    {
      "id": "shortage-003",
      "date": "2026-06-15",
      "window": "1300-1700",
      "role": "Dispatcher",
      "reason": "Evening minimum staffing gap",
      "minimumRequired": 4,
      "scheduled": 3,
      "selectedEmployeeId": "emp-james",
      "recommendation": "James is eligible as early-in before his next 1700-0500 shift."
    }
  ],
  "rotation": [
    {
      "position": 1,
      "employeeId": "emp-james",
      "displayName": "James Carter",
      "role": "Dispatcher",
      "shiftGroup": "Nights",
      "status": "eligible-for-connected",
      "mandatesYearToDate": 3,
      "forcedHoursYearToDate": 18,
      "lastMandatedDate": "2026-05-28",
      "normalShift": "1700-0500",
      "actualShift": "1700-0100 short day",
      "nextShift": "2026-06-15 1700-0500",
      "employeeViewReason": "Next in rotation when eligible for the shortage window.",
      "supervisorNotes": "Short day cutoff: eligible for 0100-0500 holdover and 1300-1700 early-in; not eligible for 0500-0900 unless overridden."
    },
    {
      "position": 2,
      "employeeId": "emp-morgan",
      "displayName": "Morgan Price",
      "role": "Dispatcher",
      "shiftGroup": "A Days",
      "status": "eligible",
      "mandatesYearToDate": 2,
      "forcedHoursYearToDate": 12,
      "lastMandatedDate": "2026-05-17",
      "normalShift": "0500-1700",
      "actualShift": "Off",
      "nextShift": "2026-06-16 0500-1700",
      "employeeViewReason": "Available if day-off mandates are enabled.",
      "supervisorNotes": "Day-off mandate cap is 8 hours."
    },
    {
      "position": 3,
      "employeeId": "emp-april",
      "displayName": "April Smith",
      "role": "Dispatcher",
      "shiftGroup": "A Days",
      "status": "unavailable",
      "mandatesYearToDate": 1,
      "forcedHoursYearToDate": 8,
      "lastMandatedDate": "2026-04-20",
      "normalShift": "0500-1700",
      "actualShift": "Sick leave",
      "nextShift": "2026-06-16 0500-1700",
      "employeeViewReason": "Unavailable for current shortage.",
      "supervisorNotes": "Caller creating the shortage; unavailable."
    },
    {
      "position": 4,
      "employeeId": "emp-brown",
      "displayName": "Taylor Brown",
      "role": "Dispatcher",
      "shiftGroup": "B Days",
      "status": "temporarily-exempt",
      "mandatesYearToDate": 4,
      "forcedHoursYearToDate": 24,
      "lastMandatedDate": "2026-06-01",
      "normalShift": "0500-1700",
      "actualShift": "Off",
      "nextShift": "2026-06-17 0500-1700",
      "employeeViewReason": "Temporarily skipped by policy.",
      "supervisorNotes": "Temporary FMLA/intermittent exemption until reviewed."
    },
    {
      "position": 5,
      "employeeId": "emp-adams",
      "displayName": "Riley Adams",
      "role": "Supervisor",
      "shiftGroup": "Nights",
      "status": "qualification-mismatch",
      "mandatesYearToDate": 2,
      "forcedHoursYearToDate": 10,
      "lastMandatedDate": "2026-05-06",
      "normalShift": "1700-0500",
      "actualShift": "1700-0500",
      "nextShift": "2026-06-15 1700-0500",
      "employeeViewReason": "Not in Dispatcher rotation for this shortage.",
      "supervisorNotes": "Supervisor role. Could be admin override only if agency allows role override."
    }
  ],
  "evaluations": [
    {
      "shortageId": "shortage-001",
      "employeeId": "emp-james",
      "displayName": "James Carter",
      "engineResult": "selected",
      "visibility": "supervisor-admin",
      "reason": "Next in rotation and eligible for 0100-0500 because the shortage completes his normal 1700-0500 shift window. Connected mandate is 4 hours and does not exceed policy caps.",
      "ruleChecks": [
        { "rule": "Rotation order", "result": "pass" },
        { "rule": "Required role", "result": "pass" },
        { "rule": "Connected mandate max hours", "result": "pass" },
        { "rule": "Maximum consecutive hours", "result": "pass" }
      ]
    },
    {
      "shortageId": "shortage-002",
      "employeeId": "emp-james",
      "displayName": "James Carter",
      "engineResult": "skipped",
      "visibility": "supervisor-admin",
      "reason": "Not adjacent to actual short-day end time or next scheduled shift. 0500-0900 is after he left at 0100 and does not connect to his next 1700 shift.",
      "ruleChecks": [
        { "rule": "Short-day window eligibility", "result": "fail" },
        { "rule": "Adjacent shift requirement", "result": "fail" }
      ]
    },
    {
      "shortageId": "shortage-003",
      "employeeId": "emp-james",
      "displayName": "James Carter",
      "engineResult": "selected",
      "visibility": "supervisor-admin",
      "reason": "Eligible as early-in before next 1700-0500 shift. Requested 4 hours equals connected mandate cap and keeps consecutive work at 16 hours.",
      "ruleChecks": [
        { "rule": "Early-in enabled", "result": "pass" },
        { "rule": "Connected mandate max hours", "result": "pass" },
        { "rule": "Maximum consecutive hours", "result": "pass" }
      ]
    }
  ],
  "overrideLog": [
    {
      "id": "override-001",
      "shortageId": "shortage-002",
      "employeeId": "emp-morgan",
      "engineRecommendation": "Select Morgan after James skipped by short-day adjacency rule.",
      "overrideAvailable": true,
      "requiredReason": true,
      "reasonOptions": ["Minimum staffing emergency", "Major incident", "Weather event", "Supervisor discretion", "Admin correction", "Custom"],
      "auditNote": "Supervisor/admin can override soft policy checks, but reason, user, timestamp, original recommendation, and violated rule must be saved."
    },
    {
      "id": "override-002",
      "shortageId": "shortage-003",
      "employeeId": "emp-james",
      "engineRecommendation": "Select James for 1300-1700 early-in.",
      "overrideAvailable": true,
      "requiredReason": true,
      "reasonOptions": ["Minimum staffing emergency", "Major incident", "Weather event", "Supervisor discretion", "Admin correction", "Custom"],
      "auditNote": "If supervisor extends past connected cap, the rule violation and override reason must be retained."
    }
  ],
  "employeeView": {
    "headline": "Current Mandation Rotation",
    "allowedFields": ["position", "displayName", "status", "employeeViewReason", "mandatesYearToDate", "lastMandatedDate"],
    "hiddenFields": ["supervisorNotes", "overrideLog", "ruleChecks", "internalEligibilityReason"]
  },
  "rules": [
    "Mandation recommendations are calculated by shortage window, not only by who is next on the list.",
    "Agency policy decides whether holdover, early-in, day-off, short-day, cross-day, and cross-shift mandates are allowed.",
    "Day-off mandates and connected-to-shift mandates have separate agency-set maximum hours.",
    "Maximum consecutive hours and minimum rest rules are checked before recommending a mandate.",
    "Supervisors/admins may override soft rules with a required reason; hard rules can be configured to block overrides.",
    "Employee-facing views hide notes and internal rule analysis; supervisor/admin views show full detail."
  ]
}
